<?xml version="1.0" encoding="UTF-8"?>
<blackBoxModelConfig xmlns="http://www.openda.org"
	xmlns:xsi="http://www.w3.org/2001/XMLSchema-instance"
	xsi:schemaLocation="http://www.openda.org http://schemas.openda.org/blackBoxModelConfig.xsd">

	<!-- Specify wrapper configuration for which this model is defined -->
	<wrapperConfig>
		<file>polluteWrapper.xml</file>
	</wrapperConfig>

	<!-- Specify wrapper configuration for which this model is defined -->
	<aliasValues>
		<alias key="templateDir"   value="template" />
		<alias key="instanceDir"   value="../work/work" />
		<alias key="binDir"        value="bin" />
		<alias key="inputFile"     value="reactive_pollution_model.input" />
		<alias key="configFile"    value="config.yaml" />
		<alias key="inputFileC1"   value="input/concentration1.txt" />
		<alias key="inputFileC2"   value="input/concentration2.txt" />
		<alias key="outputFile"    value="reactive_pollution_model.output" />
		<alias key="restartFileC1" value="restart/concentration1.txt" />
		<alias key="restartFileC2" value="restart/concentration2.txt"/>
	</aliasValues>

    <!--  <timeInfoExchangeItems start="" end="" /> -->
    <!-- <timeInfo start="1999-12-01T01:00:00" end="1999-12-01T02:00:00" timeStepInSeconds="120"/> -->
    <timeInfoExchangeItems start="start_time" timeStep="time_step" end="end_time"/>

	<exchangeItems>
		<vector id="source.factory1.discharge" ioObjectId="forcings"             elementId="source.c1_factory1.discharge" />
		<vector id="source.factory2.discharge" ioObjectId="forcings"             elementId="source.c1_factory2.discharge" />
		<vector id="concentration1.grid"       ioObjectId="state_concentration1" elementId="concentration1" />
		<vector id="concentration2.grid"       ioObjectId="state_concentration2" elementId="concentration2" />
		<vector id="reaction_time"             ioObjectId="configuration"        elementId="reaction_time" />
		<vector id="start_time"                ioObjectId="configuration"        elementId="time_control@1" />
		<vector id="time_step"                 ioObjectId="configuration"        elementId="time_control@2" />
		<vector id="end_time"                  ioObjectId="configuration"        elementId="time_control@3" />
		<vector id="locA.concentration1"       ioObjectId="output"               elementId="model.locA.concentration1" />
		<vector id="locB.concentration1"       ioObjectId="output"               elementId="model.locB.concentration1" />
		<vector id="locC.concentration1"       ioObjectId="output"               elementId="model.locC.concentration1" />
		<vector id="locA.concentration2"       ioObjectId="output"               elementId="model.locA.concentration2" />
		<vector id="locB.concentration2"       ioObjectId="output"               elementId="model.locB.concentration2" />
		<vector id="locC.concentration2"       ioObjectId="output"               elementId="model.locC.concentration2" />
	</exchangeItems>

	<doCleanUp>false</doCleanUp>

</blackBoxModelConfig>
