<?xml version="1.0" encoding="UTF-8"?>
    <blackBoxModelConfig xmlns="http://www.openda.org"
        xmlns:xsi="http://www.w3.org/2001/XMLSchema-instance"
        xsi:schemaLocation="http://www.openda.org http://schemas.openda.org/blackBoxModelConfig.xsd">

   <!-- Specify wrapper configuration for which this model is defined -->
   <wrapperConfig>
      <file>D3DWrapper.xml</file>
   </wrapperConfig>

   <!-- Specify wrapper configuration for which this model is defined -->
   <aliasValues>
      <alias key="templateDir" value="./model"/>
      <alias key="instanceDir" value="./work"/>
      <alias key="runid" value="cadagno_netcdf"/>
      <alias key="exedir" value="C:\Program Files (x86)\Deltares\delft3d_ohmw_4.01.01.rc.03\delft3d\win32\flow2d3d\bin"/>
      <alias key="linexedir" value="/opt/delft3d_v6/lnx64/flow2d3d/bin"/>
	</aliasValues>

<!-- Specify the time interval  NOTE one hour difference!!!!, openDA error!!!-->
 <!--   <timeInfo start="2015-06-01T00:00:00" end="2015-06-03T00:00:00" /> -->
	<timeInfoExchangeItems start="Tstart" end ="Tstop"/>

   <exchangeItems>

		<!--Wind Component-->
		<vector id="windu" ioObjectId="windwuFile"></vector>
		<vector id="windv" ioObjectId="windwvFile"></vector>

		<vector id="S1" ioObjectId="states" elementId="S1"/>
		<vector id="U1" ioObjectId="states" elementId="U1"/>
		<vector id="V1" ioObjectId="states" elementId="V1"/>
		<vector id="R1" ioObjectId="states" elementId="R1"/>

		<vector id="Tstart" ioObjectId="mdFile"></vector>
		<vector id="Tstop" ioObjectId="mdFile"></vector>

		<vector id="station1.temperature" ioObjectId="trih-file" elementId="station1.GRO.lay-20"/>
		<vector id="station2.temperature" ioObjectId="trih-file" elementId="station2.GRO.lay-20"/>
		<vector id="station3.temperature" ioObjectId="trih-file" elementId="station3.GRO.lay-20"/>
		<vector id="station4.temperature" ioObjectId="trih-file" elementId="station4.GRO.lay-20"/>

    </exchangeItems>

   <doCleanUp>false</doCleanUp>

</blackBoxModelConfig>
